[
  {
    "id": "k-2026-0001",
    "promise_id": "p-2026-0360",
    "handling_id": "h-2026-3620",
    "riktning": "stodjer",
    "bevis": {
      "citat": "Det är en självklar rättighet att elever som är i behov av särskilt stöd ska få det så fort behovet upptäcks, men tyvärr ser det inte ut så i dag."
    },
    "method_note": "Frågan handlar om att elever i behov av särskilt stöd ska få det tidigt, utan att villkora stödet av diagnos, vilket ligger i linje med löftet om elevlag och rätt till stöd utan diagnoskrav.",
    "confidence": 0.7,
    "extraction": {
      "model": "moonshotai/kimi-k2.7-code",
      "verified_by": "owner",
      "run_id": "foreslag-2026-07-20"
    },
    "status": "aktiv"
  },
  {
    "id": "k-2026-0002",
    "promise_id": "p-2026-0001",
    "handling_id": "h-2026-2074",
    "riktning": "stodjer",
    "bevis": {
      "citat": "För att underlätta för vanligt folk när priserna ökar vill Socialdemokraterna höja barnbidraget med 200 kronor per månad under januari, februari och mars 2023, till en kostnad av 1,5 miljarder kronor."
    },
    "motionstyp": "parti",
    "method_note": "Motionen föreslår åtgärder som höjt barnbidrag för att underlätta för vanligt folk när priserna ökar, vilket går i linje med löftet att göra livet och vardagen enklare.",
    "confidence": 0.7,
    "extraction": {
      "model": "moonshotai/kimi-k2.7-code",
      "verified_by": "owner",
      "run_id": "foreslag-2026-07-20"
    },
    "status": "aktiv"
  },
  {
    "id": "k-2026-0003",
    "promise_id": "p-2026-0002",
    "handling_id": "h-2026-10348",
    "riktning": "stodjer",
    "bevis": {
      "citat": "I den aktuella propositionen föreslås att åldersgränsen för den avgiftsfria barn- och ungdomstandvården ska sänkas från 23 till 19 år och att åldersgränsen för att kunna få del av statligt tandvårdsstöd på motsvarande sätt ska sänkas från 24 till 20 år."
    },
    "motionstyp": "kommitte",
    "method_note": "Motionen vill avslå regeringens förslag att sänka åldersgränsen för avgiftsfri tandvård, vilket innebär att den mer generösa regeln för unga behålls.",
    "confidence": 0.95,
    "extraction": {
      "model": "moonshotai/kimi-k2.7-code",
      "verified_by": "owner",
      "run_id": "foreslag-2026-07-20"
    },
    "status": "aktiv"
  },
  {
    "id": "k-2026-0004",
    "promise_id": "p-2026-0002",
    "handling_id": "h-2026-10983",
    "riktning": "stodjer",
    "bevis": {
      "citat": "Riksdagen ställer sig bakom det som anförs i motionen om att arbeta för att kostnadsfri tandvård ska finnas kvar till och med 23 års ålder och tillkännager detta för regeringen."
    },
    "motionstyp": "enskild",
    "method_note": "Motionen vill ha kostnadsfri tandvård för unga upp till 23 år, vilket motsvarar löftet om avgiftsfri tandvård för unga.",
    "confidence": 0.95,
    "extraction": {
      "model": "moonshotai/kimi-k2.7-code",
      "verified_by": "owner",
      "run_id": "foreslag-2026-07-20"
    },
    "status": "aktiv"
  },
  {
    "id": "k-2026-0005",
    "promise_id": "p-2026-0002",
    "handling_id": "h-2026-14863",
    "riktning": "stodjer",
    "bevis": {
      "citat": "säkerställa att ungdomar i åldersgruppen 19–23 år som har behov av tandreglering och som påbörjat behandlingar med vetskapen att tandvården för dem är avgiftsfri ska kunna genomföra påbörjade behandlingar utan att försättas i ekonomisk kris"
    },
    "method_note": "Frågan handlar om att behålla avgiftsfri tandvård för unga vuxna, vilket är samma sakfråga som löftet om avgiftsfri tandvård för unga.",
    "confidence": 0.9,
    "extraction": {
      "model": "moonshotai/kimi-k2.7-code",
      "verified_by": "owner",
      "run_id": "foreslag-2026-07-20"
    },
    "status": "aktiv"
  },
  {
    "id": "k-2026-0006",
    "promise_id": "p-2026-0002",
    "handling_id": "h-2026-15220",
    "riktning": "stodjer",
    "bevis": {
      "citat": "Regeringen och riksdagen har nu beslutat om att höja åldersgränsen för fri tandvård från 19 till 23 år från och med den 1 januari 2025."
    },
    "method_note": "Handlingen handlar om att åldersgränsen för avgiftsfri tandvård höjs till 23 år, vilket är samma sakfråga som löftet om avgiftsfri tandvård för unga.",
    "confidence": 0.9,
    "extraction": {
      "model": "moonshotai/kimi-k2.7-code",
      "verified_by": "owner",
      "run_id": "foreslag-2026-07-20"
    },
    "status": "aktiv"
  },
  {
    "id": "k-2026-0007",
    "promise_id": "p-2026-0009",
    "handling_id": "h-2026-17357",
    "riktning": "stodjer",
    "bevis": {
      "citat": "Genom att främja nyindustrialisering kan vi bygga ett hållbart och starkt Sverige – ett land där tillväxt, utveckling och framtidstro finns i alla delar av landet."
    },
    "motionstyp": "kommitte",
    "method_note": "Motionen vill satsa på nyindustrialisering och infrastruktur så att jobb och framtidstro skapas i hela landet, inte bara i storstäderna, vilket stöder löftet om ett landsbygdslyft.",
    "confidence": 0.85,
    "extraction": {
      "model": "moonshotai/kimi-k2.7-code",
      "verified_by": "owner",
      "run_id": "foreslag-2026-07-20"
    },
    "status": "aktiv"
  },
  {
    "id": "k-2026-0008",
    "promise_id": "p-2026-0009",
    "handling_id": "h-2026-6464",
    "riktning": "stodjer",
    "bevis": {
      "citat": "Sverige behöver ett statligt fastighetsbolag med uppdrag att förvärva och bygga fastigheter i hela landet"
    },
    "motionstyp": "enskild",
    "method_note": "Motionen vill skapa ett statligt fastighetsbolag som bygger i hela landet, vilket stöder löftet att det ska gå att leva och bygga sin framtid i hela Sverige.",
    "confidence": 0.9,
    "extraction": {
      "model": "moonshotai/kimi-k2.7-code",
      "verified_by": "owner",
      "run_id": "foreslag-2026-07-20"
    },
    "status": "aktiv"
  },
  {
    "id": "k-2026-0009",
    "promise_id": "p-2026-0009",
    "handling_id": "h-2026-6612",
    "riktning": "stodjer",
    "bevis": {
      "citat": "Besöksnäringen ökar attraktiviteten och får hela landet att leva"
    },
    "motionstyp": "kommitte",
    "method_note": "Motionen vill stärka besöksnäringen för att hela landet ska bli mer attraktivt och få människor att leva och verka där, vilket stödjer löftet om ett landsbygdslyft.",
    "confidence": 0.8,
    "extraction": {
      "model": "moonshotai/kimi-k2.7-code",
      "verified_by": "owner",
      "run_id": "foreslag-2026-07-20"
    },
    "status": "aktiv"
  },
  {
    "id": "k-2026-0010",
    "promise_id": "p-2026-0129",
    "handling_id": "h-2026-16140",
    "riktning": "motverkar",
    "bevis": {
      "citat": "Regeringens lagförslag innebär att åldersgränsen för den avgiftsfria barn- och ungdomstandvården ska sänkas från 23 till 19 år och att åldersgränsen för att kunna få del av statligt tandvårdsstöd på motsvarande sätt ska sänkas från 24 till 20 år.",
      "kalla_dok_id": "HC01SoU4"
    },
    "method_note": "Ett bifall till förslaget innebär att färre unga vuxna får avgiftsfri tandvård, vilket går emot löftet om avgiftsfri tandvård.",
    "confidence": 0.9,
    "extraction": {
      "model": "moonshotai/kimi-k2.7-code",
      "verified_by": "owner",
      "run_id": "foreslag-2026-07-20"
    },
    "status": "aktiv"
  },
  {
    "id": "k-2026-0011",
    "promise_id": "p-2026-0129",
    "handling_id": "h-2026-10284",
    "riktning": "stodjer",
    "bevis": {
      "citat": "Riksdagen avslår proposition 2023/24:158 Ändrad åldersgräns för avgiftsfri tandvård"
    },
    "motionstyp": "kommitte",
    "method_note": "Motionen handlar om att behålla den avgiftsfria tandvården för unga vuxna genom att avslå förslaget om att sänka åldersgränsen, vilket stödjer löftet om avgiftsfri tandvård.",
    "confidence": 0.95,
    "extraction": {
      "model": "moonshotai/kimi-k2.7-code",
      "verified_by": "owner",
      "run_id": "foreslag-2026-07-20"
    },
    "status": "aktiv"
  },
  {
    "id": "k-2026-0012",
    "promise_id": "p-2026-0022",
    "handling_id": "h-2026-22884",
    "riktning": "motverkar",
    "bevis": {
      "citat": "Det finns även remissinstanser som påpekar att regeringen inte på ett övertygande sätt har visat att det finns en saklig grund för de analyser och studier som föreslås. Dessutom menar man att det finns en risk för att dessa åtgärder kan påverka public service-företagens oberoende negativt.",
      "kalla_dok_id": "HD01KrU2"
    },
    "method_note": "Dokumentet handlar om ett förslag om ökad uppföljning av public service, och citatet visar att förslaget kan skada public service-företagens oberoende. Därför går ett bifall emot löftet att skydda public service.",
    "confidence": 0.75,
    "extraction": {
      "model": "moonshotai/kimi-k2.7-code",
      "verified_by": "owner",
      "run_id": "foreslag-2026-07-20"
    },
    "status": "aktiv"
  },
  {
    "id": "k-2026-0013",
    "promise_id": "p-2026-0022",
    "handling_id": "h-2026-22883",
    "riktning": "motverkar",
    "bevis": {
      "citat": "Vi föreslår därför att det förslaget från regeringen inte ska godkännas.",
      "kalla_dok_id": "HD01KrU2"
    },
    "method_note": "Voteringen gäller regeringens förslag till utformning av public service-uppdraget, och Socialdemokraternas reservation vill stoppa förslaget eftersom det tar bort viktiga krav på jämställdhet och mångfald. Ett ja till punkt 2 innebär därför att förslaget godkänns, vilket går emot Socialdemokraternas löfte att skydda public service.",
    "confidence": 0.8,
    "extraction": {
      "model": "moonshotai/kimi-k2.7-code",
      "verified_by": "owner",
      "run_id": "foreslag-2026-07-20"
    },
    "status": "aktiv"
  },
  {
    "id": "k-2026-0014",
    "promise_id": "p-2026-0022",
    "handling_id": "h-2026-1503",
    "riktning": "stodjer",
    "bevis": {
      "citat": "Riksdagen ställer sig bakom det som anförs i motionen om att se över hur public services uppdrag och oberoende kan grundlagsfästas och tillkännager detta för regeringen."
    },
    "motionstyp": "enskild",